{
  "bundleVersion": 1,
  "plan": 1,
  "smoke": false,
  "generatedAt": "2026-11-02T01:18:34.944Z",
  "environment": {
    "id": "apple-silicon-chrome",
    "browser": {
      "name": "chrome",
      "version": "156.0.8078.74",
      "source": "client-hints"
    },
    "os": {
      "name": "macos",
      "version": "27.2.0",
      "source": "client-hints"
    },
    "architecture": "arm",
    "hardware": "Apple M4 Pro",
    "notes": "hardware added after the run: same Mac as the apple-silicon-safari26 bundle (maintainer)",
    "adapter": {
      "vendor": "apple",
      "architecture": "metal-3",
      "device": "",
      "description": "",
      "isFallbackAdapter": false
    },
    "timestampQuery": {
      "adapter": true,
      "device": true
    },
    "userAgent": "Mozilla/5.0 (Macintosh; Intel Mac OS X 10_15_7) AppleWebKit/537.36 (KHTML, like Gecko) Chrome/156.0.0.0 Safari/537.36",
    "source": {
      "version": "0.6.0",
      "commit": "6fd3b07d8900a37f893e6c8d391d80beca13ead9",
      "builtAt": "2026-11-01T23:23:19.887Z"
    }
  },
  "records": [
    {
      "schemaVersion": 1,
      "generatedAt": "2026-11-02T01:18:31.753Z",
      "source": {
        "version": "0.6.0",
        "commit": "6fd3b07d8900a37f893e6c8d391d80beca13ead9",
        "url": "https://github.com/scttfrdmn/webgpu-compute-exploration/tree/6fd3b07d8900a37f893e6c8d391d80beca13ead9",
        "builtAt": "2026-11-01T23:23:19.887Z"
      },
      "experiment": {
        "exampleId": "matrix-multiplication",
        "id": "cpu-naive-tiled",
        "title": "CPU vs naive GPU vs tiled GPU"
      },
      "settings": {
        "maxN": 1024
      },
      "protocol": {
        "warmup": 1,
        "repeats": 5,
        "timing": "timestamp-query",
        "budgetMs": 20000,
        "statistic": "median",
        "spread": "iqr"
      },
      "verification": [
        {
          "metric": "naive GPU: max over n of (max rel. error) / (√n·u)",
          "value": 0.8622476033290579,
          "tolerance": "<= 4 (error ≤ 4·√n·u)",
          "reference": "float64 product of 16 sampled rows at n = 64, 128, 256, 512, 1024",
          "status": "pass"
        },
        {
          "metric": "tiled GPU: max over n of (max rel. error) / (√n·u)",
          "value": 0.8622476033290579,
          "tolerance": "<= 4 (error ≤ 4·√n·u)",
          "reference": "float64 product of 16 sampled rows at n = 64, 128, 256, 512, 1024",
          "status": "pass"
        },
        {
          "metric": "CPU baseline: max over n of (max rel. error) / (√n·u)",
          "value": 0.8600016040051426,
          "tolerance": "<= 4 (error ≤ 4·√n·u)",
          "reference": "float64 product of 16 sampled rows at n = 64, 128, 256, 512",
          "status": "pass"
        },
        {
          "metric": "naive vs tiled: max over n of max |naive − tiled| / |C| / (√n·u)",
          "value": 0,
          "tolerance": "<= 4 (error ≤ 4·√n·u)",
          "reference": "the two GPU kernels on the same inputs (same summation order: expected 0 without FMA differences)",
          "status": "pass"
        }
      ],
      "interpretation": [
        {
          "claim": "naive GPU: time grows like n³",
          "predicted": "log-log slope 3 (2n³ flops; ±0.15 for cache effects)",
          "measured": "0.73 (no interval from 2 points) over n = 512 … 1024",
          "agrees": null,
          "note": "Fitted over the sizes whose median GPU (timestamp) time is at least 1 ms (n = 512 … 1024); smaller products are launch-, latency- or timer-bound, so their times do not grow like n³ yet. Over all 5 sizes the slope is 1.86. At least 3 sizes are needed for an uncertainty; with fewer, this claim stays undecided."
        },
        {
          "claim": "tiled GPU: time grows like n³",
          "predicted": "log-log slope 3 (2n³ flops; ±0.15 for cache effects)",
          "measured": "1 size(s) with median ≥ 1 ms",
          "agrees": null,
          "note": "Fitted over the sizes whose median GPU (timestamp) time is at least 1 ms (n = 1024 … 1024); smaller products are launch-, latency- or timer-bound, so their times do not grow like n³ yet. Over all 4 sizes the slope is 1.64. At least 3 sizes are needed for an uncertainty; with fewer, this claim stays undecided."
        },
        {
          "claim": "CPU (blocked JS): time grows like n³",
          "predicted": "log-log slope 3 (2n³ flops; ±0.15 for cache effects)",
          "measured": "2.97 (95% CI 2.61 … 3.32) over n = 128 … 512",
          "agrees": true,
          "note": "Fitted over the sizes whose median time is at least 1 ms (n = 128 … 512); smaller products are launch-, latency- or timer-bound, so their times do not grow like n³ yet. Over all 4 sizes the slope is 2.55."
        },
        {
          "claim": "Tiling speeds the GPU kernel up",
          "predicted": "tiled faster (speedup > 1): 16× fewer global loads (arithmetic intensity 4 vs 0.25 flop/byte); typically 2–10× on real GPUs",
          "measured": "2.21× (2.21×–2.23×) at n = 1024",
          "agrees": true,
          "note": "The range is conservative (naive q1 / tiled q3 … naive q3 / tiled q1); undecided when it contains 1. The tiled kernel also reads A and B along rows (coalesced) where the naive one reads A across rows, so part of the gain is access pattern, not only reuse. On a software GPU workgroup memory is ordinary memory and barriers are expensive, so tiling can lose."
        },
        {
          "claim": "The naive kernel is bound by memory traffic, not arithmetic",
          "predicted": "naive GFLOPS ≤ 0.25 × the bandwidth that serves its loads (8 bytes per multiply-add); tiled ≤ 4 × bandwidth",
          "measured": "naive: 1524 GB/s of loads, tiled: 210 GB/s of global loads, at n = 1024",
          "agrees": null,
          "note": "Compare with your GPU's memory bandwidth (not known to the page). If the naive figure exceeds it, caches are serving most of its loads: the reuse happens, but in cache rather than in workgroup memory, and cache bandwidth is the limit."
        },
        {
          "claim": "The GPU beats one CPU core from some n on",
          "predicted": "yes: GPU time is ≈ a fixed launch cost until the GPU is full, CPU time grows like n³ from the start (CPU measured up to n = 512)",
          "measured": "GPU faster from n = 128 on; at n = 512: tiled GPU 0.393 (0.393–0.393) ms vs CPU 109.8 (109.5–111.6) ms",
          "agrees": true,
          "note": "Kernel time only; with upload and readback the tiled GPU takes 2.100 ms (wall). Where the crossover falls depends on the GPU, the CPU and the browser; undecided when the spreads overlap."
        }
      ],
      "environment": {
        "userAgent": "Mozilla/5.0 (Macintosh; Intel Mac OS X 10_15_7) AppleWebKit/537.36 (KHTML, like Gecko) Chrome/156.0.0.0 Safari/537.36",
        "adapter": {
          "vendor": "apple",
          "architecture": "metal-3",
          "device": "",
          "description": "",
          "isFallbackAdapter": false
        },
        "features": [
          "core-features-and-limits",
          "timestamp-query"
        ],
        "limits": {
          "maxBufferSize": 268435456,
          "maxStorageBufferBindingSize": 134217728,
          "maxComputeWorkgroupStorageSize": 16384,
          "maxComputeInvocationsPerWorkgroup": 256,
          "maxComputeWorkgroupSizeX": 256,
          "maxComputeWorkgroupsPerDimension": 65535,
          "maxStorageBuffersPerShaderStage": 8
        }
      },
      "outcome": {
        "status": "done",
        "steps": 5
      },
      "columns": [
        {
          "key": "n",
          "label": "n (n × n · n × n)"
        },
        {
          "key": "timing",
          "label": "GPU time from"
        },
        {
          "key": "cpuGflops",
          "label": "CPU GFLOPS",
          "unit": "GFLOP/s",
          "range": true
        },
        {
          "key": "naiveGflops",
          "label": "naive GPU GFLOPS",
          "unit": "GFLOP/s",
          "range": true
        },
        {
          "key": "tiledGflops",
          "label": "tiled GPU GFLOPS",
          "unit": "GFLOP/s",
          "range": true
        },
        {
          "key": "cpuMs",
          "label": "CPU ms",
          "unit": "ms",
          "range": true
        },
        {
          "key": "naiveMs",
          "label": "naive GPU ms",
          "unit": "ms",
          "range": true
        },
        {
          "key": "tiledMs",
          "label": "tiled GPU ms",
          "unit": "ms",
          "range": true
        },
        {
          "key": "speedup",
          "label": "tiled vs naive",
          "range": true
        },
        {
          "key": "cpuErr",
          "label": "CPU max rel. error"
        },
        {
          "key": "naiveErr",
          "label": "naive max rel. error"
        },
        {
          "key": "tiledErr",
          "label": "tiled max rel. error"
        },
        {
          "key": "naiveVsTiled",
          "label": "max |naive − tiled| / |C|"
        },
        {
          "key": "sqrtNu",
          "label": "√n·u"
        },
        {
          "key": "naiveCompile",
          "label": "naive compile ms",
          "unit": "ms",
          "range": true
        },
        {
          "key": "naiveUpload",
          "label": "naive upload ms",
          "unit": "ms",
          "range": true
        },
        {
          "key": "naiveDispatch",
          "label": "naive dispatch ms",
          "unit": "ms",
          "range": true
        },
        {
          "key": "naiveReadback",
          "label": "naive readback ms",
          "unit": "ms",
          "range": true
        },
        {
          "key": "tiledCompile",
          "label": "tiled compile ms",
          "unit": "ms",
          "range": true
        },
        {
          "key": "tiledUpload",
          "label": "tiled upload ms",
          "unit": "ms",
          "range": true
        },
        {